text,annotation_34,annotation_5,annotation_20,annotation_4
"I’m so tired of the fear mongering. Every variant has been a red alert for the media. 

The vaccines work let’s just move on.",anti-mitigation,anti-mitigation,unclear,pro-mitigation
We need a vaccine soonest.  Not sure why Russia can get one out before us.,pro-mitigation,unclear,pro-mitigation,pro-mitigation
The lack of leadership on this is astonishing,unclear,unclear,unclear,unclear
"Alternative reality is really gaining traction.

It’s probably true that if we had Fox News in 1955, we would probably still be dealing with polio.",pro-mitigation,unclear,unclear,unclear
"I would be much more likely to patronize a business such as an airline, restaurant, concert venue, theater, store, etc of I knew the employees are vaccinated.",pro-mitigation,pro-mitigation,pro-mitigation,pro-mitigation
"There are many immune compromised people who get reinfected, or for who the vaccine doesn't work well. What percentage are these people? I feel bad that they are so at risk. However, every person can't mask for life because of them.",anti-mitigation,anti-mitigation,anti-mitigation,unclear
"Though I like the restaurant where I have eaten, because it is quiet, even when full, it is not the place, but the food.  We order take-out weekly and the restaurant is doing well.  It serves Vietnamese food.  American food I can prepare.",unclear,unclear,anti-mitigation,unclear
One of the commenters said it best.   Business needs to provide a safe work place.   That includes protection from the spread of disease.,pro-mitigation,unclear,pro-mitigation,pro-mitigation
"It’s really unfortunate that the US has turned into such a society of people whose overwhelming concern is for their rights, and not at all for their responsibilities.

If all people who could get vaccinated did, instead of cavilling and believing conspiracy theories (the latest ones about reproduction and shedding vaccine would be funny if not so harmful) we wouldn’t be in this place. 

We’d be well on the way to herd immunity so that those who really can’t get the vaccine—babies and the immunocompromised etc—wouldn’t have to worry. There’s be no need for any of this fuss; only people travelling overseas would need a vaccine passport. But here we are. And as part of the generation that willingly eradicated smallpox, I’m pretty disgusted with the US.",pro-mitigation,unclear,anti-mitigation,pro-mitigation
"Hmm. Businesses may require vaccinations for their employees. They can refuse employment to those who decline or require N95 masks for those who decline. Very likely businesses will generally win litigation on these issues. From a business standpoint it may  be a good move. How many people would prefer to fly, attend concert venues, etc where vaccination is required for attendance? The first airline that requires vaccinations for all employees and all passengers I suspect will be preferred by fliers to those that do not and the rest will follow. In addition to good business the move by these private entities can play an important role in ending the pandemic and save many thousands of lives.",pro-mitigation,pro-mitigation,pro-mitigation,unclear
Say companies cannot require vaccination for people to go back to the office. That means they are requiring people to go back to the office with unvaccinated people. It would seem to be a much bigger liability to have people get sick or die than to have people refuse (except for medical conditions) to get the vaccine.,pro-mitigation,pro-mitigation,pro-mitigation,pro-mitigation
Maybe it would be a good idea to either blur or crop out this person’s badge.,unclear,unclear,unclear,unclear
"Masking is patriotic
Vaccination is patriotic

Don’t pretend to be patriotic on July 4 if you can’t do the simple easy free thing and protect others.  you are just being selfish.",pro-mitigation,pro-mitigation,pro-mitigation,pro-mitigation
If employees are required to be on-site without a remote-work alternative vaccinations should also be required.,pro-mitigation,pro-mitigation,pro-mitigation,pro-mitigation
"Companies have been drug testing for decades and no one cares about that invasion of privacy.  So until drug test are illegal, mandatory vaccines isn’t an invasion of privacy.",pro-mitigation,unclear,unclear,pro-mitigation
Businesses could mandate employees who are unvaccinated have to wear a mask and those who are vaccinated don't have too.,pro-mitigation,unclear,anti-mitigation,pro-mitigation
"I think an uptick in cases is likely in the fall, just like there was last year. 

But the vaccination rate in my state is 70%; if cases start ticking up significantly here, that means that breakthrough cases are really becoming an issue. If that happens, then I'll absolutely starting masking again. Until that happens? I'm good.",anti-mitigation,pro-mitigation,pro-mitigation,unclear
Just saw Dr. Fauci on MSNBC. He’s sticking with the CDC guidance. That’s good enough for me.,unclear,unclear,pro-mitigation,pro-mitigation
"We have demonstrated that we as a culture cannot defer gratification to save lives Yet, we expect college students to follow unenforceable protocols established by out of touch administrators.",unclear,unclear,unclear,unclear
Nope. The time for general mask usage has passed. The “Immunocompromised” are set to rejoin society with the same issue they once had before this set in:  the reality that their life situation requires that they take additional steps to ensure their own safety.,anti-mitigation,unclear,anti-mitigation,anti-mitigation
"Given that one of the major risk factors for Covid is obesity, I'd sooner see an exercise mandate than the return of masks.",anti-mitigation,anti-mitigation,unclear,anti-mitigation
"It is not only inappropriate to call companies that require vaccination ""Big Brother,"" Orwell's name for the government, but this headline and article encourage anti-vaxxers. 
Companies not only have a right to demand that workers, with few exceptions, be vaccinated, they have a responsibility to do this to make their workplaces safe, and in some cases keep customers and others safe. 
I am very disappointed to see the times publish this article.",pro-mitigation,unclear,pro-mitigation,pro-mitigation
"I once had to do a company survey to comply with some federal regulations.  It was critical that we get a high response rate.

We came up with a little encouragement - those departments that had a 95% repsonse or higher would be part of a raffle to win a significant money prize.  The final result?  The response was 99% overall.

Companys like United could do the same.  Raffle off some large money prizes for those who get vaccinated.  (High level management should be excluded.)  Only a few will win, but having the chance to win something big can be a significant motivator.",pro-mitigation,pro-mitigation,pro-mitigation,unclear
the american people will nor respond well or rationally to having to act like adults again.,unclear,unclear,unclear,unclear
Corridor-19:was listed on the menu under take out.,unclear,unclear,unclear,unclear
Good luck with that.,unclear,unclear,unclear,unclear
"What is the mystery? The country is not fully open, not back to normal. People ""studying"" these things seem overpaid, IMO.",unclear,unclear,unclear,unclear
Big brother ?  No.    As an employer I have an moral obligation to take all steps to best ensure the safety and health of my employees.   That would include  a requirement that all my employees get a Covid 19 vaccination.,pro-mitigation,pro-mitigation,pro-mitigation,pro-mitigation
"I DON'T UNDERSTAND! the hesitancy of employers mandating COVID vaccinations if they are working with the public or around other employees. 

Non-vaccinated employees should be separated from the public and other employees either physically or required to wear a Mask.

That's what our local hospital does. If an employee doesn't want to get the Flu shot for whatever reason, they must be Masked at work. PERIOD!",pro-mitigation,pro-mitigation,pro-mitigation,pro-mitigation
The issue is more complex for employers with public facing employees. If United Airlines mandates vaccination of its employees and passengers I will chose it over an airline that doesn't.,pro-mitigation,anti-mitigation,anti-mitigation,pro-mitigation
The girl is that photo is stunning.  Hope she’s got her vaccine!,pro-mitigation,pro-mitigation,unclear,pro-mitigation
"After the fear mongering of the first 85% of the article, the last 15% tells me what I need to know: as a vaccinated person, I’m unlikely to catch Delta, and if I do it will almost surely be asymptomatic. So the threat lies with the unvaccinated. 

Works for me. They should get vaccinated. I did, and I am done with this nonsense.",anti-mitigation,pro-mitigation,pro-mitigation,pro-mitigation
"More accurate headline:

The Nation Forgot How to Cook and Now Regrets It",unclear,unclear,unclear,unclear
In hospitals we have been mandated to get flu vaccines for decades. We've been mandated to get the Covid vaccine this year. It's no big deal. Be an adult and get the vaccine (and I fully expect children to be more 'adult' about this than many adults!).,pro-mitigation,pro-mitigation,pro-mitigation,pro-mitigation
"The government should not be allowed to forcibly prevent American's from earning a livelihood if it is not willing to compensate them, period.

I'm sorry if this sounds cruel, but I shouldn't have to bleed my life savings to keep your great grandmother safe.",anti-mitigation,unclear,anti-mitigation,unclear
I am all for individual liberty but to those who invoke it and then take advantage of the benefits brought by those who have acted for the common good it’s nothing more than selfishness. Would you prefer that we had all followed your misguided lead so we could instead be experiencing the horror that is now engulfing India?,pro-mitigation,unclear,unclear,pro-mitigation
"""Restaurants generate a lot of sales and payroll tax revenue........said Daniel Patterson, a chef and a restaurateur in California""

Our so-called president is demanding a payroll tax cut. How is a payroll tax cut going to help restaurants and bars shuttered because of Covid?",unclear,unclear,anti-mitigation,unclear
Nope. Not gonna wear one. Sorry!,anti-mitigation,unclear,anti-mitigation,anti-mitigation
"Very simple, I’ll pick companies business and destinations that are pro vaccination.",pro-mitigation,unclear,pro-mitigation,pro-mitigation
"No more mask wearing. There could be varients  of this for years to come. People who are immunocompromised will just have to take the same safety precautions they do for flu season or any other potential situation that could harm them.  I do not believe that the majority of Americans will ever bow to this kind of government intrusion into their lives ever again. If you’re one of the people who are afraid, then wear your mask and stay inside.",anti-mitigation,anti-mitigation,anti-mitigation,anti-mitigation
"If vaccines and/or some for of “passport” end up being a requirement for normal participation in public life, including work, school, travel, or business attendance, then pass should also be given to those previously infected and recovered who can prove antibody presence. They do this already in Israel, and the EU is also including it in the development of their Digital Green Certificate (they’re even including recent negative tests.) Why can’t we?",anti-mitigation,unclear,pro-mitigation,unclear
"The sooner the test case on this issue is decided by the courts the better. This is a race against variants, and the variants are winning.  The president of the United States and the governor of Florida rarely agree on anything, but both men say to get vaccinated and life can return to normal.  Time is of the essence.",pro-mitigation,pro-mitigation,pro-mitigation,pro-mitigation
"I’m just incredulous that people make such a fuss about being asked to wear masks. What a bunch of babies! 

I’m fully vaxxed and routinely wear my mask in stores etc. on the basis that if I can do anything with even the remotest chance of helping an immunocompromised person or kid, then I’m going to do it. Not hosting a happily mutating virus is an added incentive. It’s just not a big deal to do it.

Grow up, America.",pro-mitigation,pro-mitigation,pro-mitigation,pro-mitigation
"We have not eaten at a restaurant since early March. We will not eat at a restaurant until there is a safe, effective vaccine available. We are both seniors and it’s just not worth the risk.",pro-mitigation,pro-mitigation,pro-mitigation,pro-mitigation
So far the military has not required all its personel to get vaccinated.   President Biden should order this to be done.,pro-mitigation,pro-mitigation,pro-mitigation,pro-mitigation
Get vaccinated or accept the risk.  No more masks for the vaccinated.,unclear,unclear,unclear,pro-mitigation
Meanwhile Michigan GOP members introduced a bill making it illegal for the state and any state run entity to require proof of vaccination.,unclear,anti-mitigation,anti-mitigation,anti-mitigation
"I need some assurance that anyone I interact with or share airspace with--in a restaurant,  on an airplane,  in a store, at the movies, etc--is not a threat to my health. Without that assurance,  why shouldn't I be reluctant to fly, eat out, shop? C'mon people. I want to live a full life again.  Don't you?",unclear,anti-mitigation,pro-mitigation,unclear
"An employee could be encouraged to get jabbed until a set date, at which time it would be required.  This would give the employee time to decide, and time to find another job.  And yes, require the jab for new hires.  An employee who does not cooperate (for whatever stupid reason) is not an employee I want in my company.  That person will always cause more problems than the value of their output.",pro-mitigation,unclear,unclear,pro-mitigation
Just do it.,unclear,unclear,unclear,pro-mitigation
"Sanitizing windows seems like a purely symbolic gesture when you consider that the greater way in which the virus is spread indoors is by customers who are unmasked while eating and drinking and talking loudly. All the other cleaning measures are made superfluous by unmasked patrons. Sadly, the only way ahead for restaurants and bars is to remain closed for indoor dining until a vaccine arrives. In the interim, the government urgently needs to find a way to subsidize their wages and rent.",pro-mitigation,pro-mitigation,unclear,pro-mitigation
My daughters company is bringing back their employees to the office next month. For those who choose not to be vaccinated they must show a negative Covid test every 72 hours.,unclear,pro-mitigation,pro-mitigation,pro-mitigation
"Or just keep everything the way it's been for over the past year, with everyone working remotely.  Works for me.",pro-mitigation,unclear,unclear,anti-mitigation
"Bottom line is that you can’t force somebody to take the vaccine, many of us have it but I think it’s a gross violation of civil rights to force anyone in order to work, get on a plane or go to a sports event, Supreme Court will strike it down as soon as it’s brought..￼",anti-mitigation,anti-mitigation,anti-mitigation,anti-mitigation
"Guns + coronavirus = why would I ever want to go to any large public place again? Home from now on, thanks.",pro-mitigation,unclear,unclear,unclear
"how about i share Dr Fauci's thoughts from last night on PBS (skip to 4 m if youre in a hurry) --<a href=""https://www.youtube.com/watch?v=cJEz8Xfq9iU"" target=""_blank"">https://www.youtube.com/watch?v=cJEz8Xfq9iU</a>",pro-mitigation,pro-mitigation,pro-mitigation,pro-mitigation
"Most employees require vaccination for dozens of diseases. So do many schools, and sports. And gym memberships. 
So why wasn't everyone complaining 50 years ago?",pro-mitigation,unclear,anti-mitigation,pro-mitigation
Quick turnaround testing... we desperately need a nationwide crash program to get reliable Covid testing with 24-to-48-hour turnaround.  Maybe in January?,pro-mitigation,unclear,pro-mitigation,pro-mitigation
"I do like the cuomo-Yankees-Mets plan: if you got a shot you can sit with the adults; and if you go to a game but haven't, you can sit with the sparse ever-shrinking socially-distanced crowd, or get a shot and go to another game for free.

It's simple, really: real baseball fans care for their fellow fan.

Get your shot!  It's proven far safer than the alternative.",pro-mitigation,pro-mitigation,,pro-mitigation
"I am not opposed to a COVID-19 vaccine. But, as long as the current vaccines only have emergency approval I will not get it. Once full approval is granted, then ok.",unclear,pro-mitigation,unclear,pro-mitigation
"Just like many vaccinations are mandatory to attend school, the COVID-19 vaccine should be required to participate in society without restrictions.",pro-mitigation,pro-mitigation,pro-mitigation,pro-mitigation
"Vaccination is not a personal choice, but a public health necessity.  While sticking a needle into someone’s arm is clearly an invasion of personal privacy, eliminating death and restoring societal functioning is far more important than the invasion. There should be a vaccine passport and fines should be imposed upon those individuals who refuse to get vaccinated.  With the light at the end of the tunnel clearly visible, now is not the time for polite encouragement.",pro-mitigation,anti-mitigation,pro-mitigation,pro-mitigation
"Deep bowls of farro?  I’d bet most farro lovers are still cooking at home, not hitting restaurants for a margarita and a burger.  Would never risk my life or the lives of others for farro.",pro-mitigation,unclear,pro-mitigation,pro-mitigation
"We left the United States and went to Norway (dual citizens) so our children can go to school this fall.  The day we arrived last week, the government had a press conference, alarmed because the positivity rate had climbed to... 0.9%  In response, they banned the sale of alcohol after midnight nationwide, effective immediately.  There have been no protests.",pro-mitigation,unclear,unclear,unclear
"A lot of commenters here rightly suggest that unvaccinated people be charged more for health insurance coverage due to the added risk of predictable increased health care costs they'll incur if they get sick. I would take a different approach. Insurance companies should have no obligation to pay covid NJ related costs once the vaccine is widely available on demand.

Personal responsibility goes both ways. If you're going to avoid the vaccine because you believe you have a right to decide what happens to your health, you should take responsibility for paying for any costs related to a preventable illness should you get it.

Such a policy would quickly expose the lie behind ""personal responsibility"", that it is an excuse for freeloading or just a political statement. The same people who claim they have a right to avoid getting vaccinated would be the first to demand their health insurance company, using premiums gathered from a large group of their fellow citizens, pay for their illness that could have been prevented if they took actual responsibility for their health.

Of course, they'd do everything possible to make it look like the insurance company was the villain.",pro-mitigation,unclear,pro-mitigation,unclear
Listen to today's The Daily and you will realize that the only responsible thing to do as a manger is require vaccination to work. The science shows that the unvaccinated put those who are vaccinated but immunocompromised at increased risk of mortality. Since when is it your right to risk the life of another citizen? In legal terminology it is called negligence and it is a crime.,pro-mitigation,unclear,pro-mitigation,pro-mitigation
"My husband and I will continue to wear a mask.  We wear one so we will remain healthy and safe, but also to protect each other.  We lost too many friends to COVID in the past 14 months.  Neither of us could bear to lose the other, especially through reckless and thoughtless measures.

In the end, we believe that people will do what they think is best for them, even if it is in direct opposition to what we think or feel.

Getting fully vaccinated and wearing a mask is a no-brainer to us, but then our primary responsibility to our   ourselves and our own health.",pro-mitigation,pro-mitigation,pro-mitigation,pro-mitigation
"Wearing a mask in indoor public places is a nearly effortless way to prevent the spread of illness, and its hard to understand why some find it so difficult?  Perhaps they are fragile or anxious to begin with?  Suffocating snowflakes?",pro-mitigation,anti-mitigation,anti-mitigation,pro-mitigation
"If requiring employees to be vaccinated is not tenable because of employee concerns, a (partial) solution might be to require non-medically excused unvaccinated employees to wear face masks at all times, never get within 6 feet of anyone, and not be allowed in many common areas. (And wear dunce caps?)
Perhaps socially shaming ignorance could prove effective? (It's worked so well on climate change deniers!)",pro-mitigation,unclear,pro-mitigation,pro-mitigation
I truly don’t understand why people are so adamant about not wearing masks. Is it really that big of a problem to wear a mask? I’m fully vaccinated but continue to wear my mask in public. My young children can’t be vaccinated yet and I will mask until they can be protected. If simply wearing a mask can save lives why are people so opposed to it?,pro-mitigation,pro-mitigation,pro-mitigation,pro-mitigation
"I reviewed the data linked in this article. To be honest, I don't think it supports the headline and the main conclusions of the article. In many states, retail and office spaces lead to much more infection than bars and restaurants. And across the board, nursing homes and industrial settings are way worse. I understand, hypothetically, the conclusion that bars are dangerous, but I'm just not sure the data bear that out in a meaningful way. This piece feels, to me, like more of a political statement supporting keeping bars closed more than a nuanced take on the data.",anti-mitigation,unclear,anti-mitigation,unclear
"My guess is that most businesses won't require vaccines, but I hope they use incentives to get their employees to do so, if necessary.  To the degree that a business interfaces with the public, to that degree it should mandate employee vaxes.  I want any airline I fly on to do so, and any restaurant or bar as well, and I want them to tell me thru advertisements that they do so.

Some businesses are running up against the Trumpian anti-vax passport laws like what we're passing here in Iowa.  It's bad news when any institution does anything that discourages people getting vaccinated.  This is primarily a public health problem, and that communitarian instinct should be uppermost in the considerations of anyone with power to induce others to vaccinate against covid.",pro-mitigation,pro-mitigation,anti-mitigation,pro-mitigation
I have a small company of 10 employees. One employee is not vaccinated and won't get vaccinated. So everyone else is effectively forced to wear a mask. Thankfully we have an at will state. I can fire this employee for any reason. Funny to me how people will choose unemployment and financial instability over being a courteous and responsible member of society.,pro-mitigation,unclear,pro-mitigation,pro-mitigation
"What about people who have already had the virus and have developed antibodies naturally?

This is just as good as having the vaccination, and many scientists think it is even better, as you have been exposed to the whole virus.

A positive antibody test should count as much as having the vaccination.",anti-mitigation,pro-mitigation,unclear,anti-mitigation
"The fact is a very small minority of people are medically prohibited from immunization. There is no legitimate religion that objects to immunization. Yes there are phony religions. Some might say the ""legit"" ones are phony too.  

So refusing to get immunized should not be a choice for anyone not medically prohibited.",pro-mitigation,unclear,pro-mitigation,pro-mitigation
"Mask or no mask, people better get themselves in survival mode. Humans have infested the Earth and the Earth is just beginning to fight back. The Earth has a big advantage.",unclear,unclear,unclear,unclear
"I'm vaccinated, but when I am indoors, I wear a mask. I do that because not everyone can be vaccinated.

However, once everyone, including children, has access to the vaccine, I will not be wearing a mask when not in very high risk situations, e.g., on a train or plane. Quite simply, I am not going to subsidize those who are too foolish or selfish to get vaccinated.

I am concerned about those who can't be vaccinated for a medical reason, but the real risk for them is people who don't get vaccinated. If not for them, we could wipe this disease out almost overnight, and life could go back to normal.

Their behavior is shameful.",pro-mitigation,pro-mitigation,pro-mitigation,pro-mitigation
There is no moral high ground here. You want people to be depressed and lose their business and jobs and be unemployed? You want spiking gun violence and people in deep distress? Then keep pretending to take the high ground.,unclear,unclear,anti-mitigation,unclear
