text,annotation_34,annotation_5,annotation_20,annotation_4
"Since March 2020, until last month, I wore a mask religiously. I socially distanced for the entire pandemic and the minute a vaccine was available to me, I took it without question. Before doing so I assiduously followed The development of these vaccines and all of the concomitant risks and concerns. I continue to stay abreast of developments and conditions regarding COVID-19. I do this for myself and I do this for others. I am already aware that those who have been double innoculated with the Pfizer or Moderna vaccines are at extremely minimal risk of contracting the delta variant.

Therefore, I have a little patience or sympathy in what will soon be July of 2021 for any adult who is still dragging his or her feet about getting vaccinated. Covid vaccines have become extremely widely available and can be acquired for free at most any large chain drugstore at a moments notice.

I have continued to wear masks at the supermarket and if I am going to be in any interior location where there are young children present. I am happy to keep doing this until kids are vaccinated. 

On the other hand, I am not going to swelter in a a face mask in 90 and 100° weather all summer or in my gym every day to accommodate irresponsible, foolish, and lazy people. If you have unvaccinated people in your home, or you won’t be vaccinated, at this stage of the pandemic, it is now on you to continue to wear masks and socially isolate to the degree that is appropriate to your individual circumstances.",unclear,pro-mitigation,unclear,pro-mitigation
"As a worker, I do not want to spend 40 hours a week next to a person who has not been vaccinated, and I feel might rights should be respected. That for me is the essence of the problem. 

I know some workers are being granted the right to work from home if they share this concern, while the plan is for everyone in the workplace to wear masks and social distance until herd immunity is achieved, if that ever happens. Not the best solution, but then what is?",pro-mitigation,unclear,pro-mitigation,pro-mitigation
"people are dumb. Not most I'd say, but enough. So, i choose to advoid things like this. Unfortunately the effects of this 'dumb' minority impacts the majority.  Then same group will complain the government didn't do enough when their own family or friends die from COVID.",pro-mitigation,pro-mitigation,pro-mitigation,pro-mitigation
"Wow,New Yorkers can remove their face masks. Floridians have mostly been mask less for10 months. School have been open since September.

I live in the largest retirement community in America called The Villages. If you go to church or shopping at the supermarket I would wear a mask.  The rest of the NO MASK .It is a nice way to live.

Maybe someday New Yorkers will enjoy going mask-less?



But.....I doubt it.",anti-mitigation,anti-mitigation,anti-mitigation,anti-mitigation
This article highlights a particular sector (hospitality and restaurants) that also happens to characterize the US as a whole (nor can I exclude myself): we're shortsighted and woefully fall of the wrong side of the marshmallow experiment.,unclear,unclear,unclear,unclear
"What's strange about this whole thing is that the same people who feel it is an intrusion for the government or their employer to require a simple vaccine have no problem with requiring women to take a pregnancy to delivery.    Perhaps they have never been through pregnancy and delivery, so they can't compare the intrusiveness of the two.",pro-mitigation,unclear,unclear,unclear
"""Delicate decision"" is a term for the weak-willed.

The corporations of this country need to take a stand and do what is right. 

Those refusing to vaccinate should be sent on their merry way to seek ""better"" opportunities for ""personal freedom"". There will be plenty of compliant replacements willing to fill your spot.

This requirement is not only necessary to protect all employees, but to protect others that they interact with, including in some industries the companies' customers.

It is unfortunate that such a decision needs to be made, a decision that would not be necessary had the American general public, along with their leaders, been more diligent in eliminating the virus.

""We made our bed and need now to sleep well in it.""",pro-mitigation,pro-mitigation,pro-mitigation,pro-mitigation
"Some communities prematurely eased COVID restrictions because many persons were frustrated with wearing masks or doing anything that requires them to care for anyone other than themselves. My city requires unvaccinated persons to wear masks, but we are on the honor system, which is a joke. The city says that less than half of the population is vaccinated, but most people don't wear masks. If the honor system worked, I should see about 50 percent of people wearing masks, unless unvaccinated persons are all locked inside their homes.",pro-mitigation,unclear,unclear,pro-mitigation
There’s nothing delicate about it. Most businesses ban guns and you can’t drive to work as fast as you want. Selfish behavior that endangers others should have consequences.,pro-mitigation,unclear,unclear,unclear
"If you still have the money to go out to bars, then why not just give the money to your favorite bar and then go home and make your own drink? It it really SO important to go out and socialize right now? Can't we all agree that we're in this together? Give money to your favorite place - restaurant, salon, bar, whatever - but don't force workers back in. Keep your establishments going so they can pay their workers to stay home.",pro-mitigation,unclear,pro-mitigation,pro-mitigation
Stupidity and the belief of invincibility. Well the reckoning will come soon enough.,unclear,unclear,unclear,pro-mitigation
Why should I wear a mask and socially distance if I am fully immunized and it is highly improbable that I can spread the virus to others?,anti-mitigation,anti-mitigation,anti-mitigation,anti-mitigation
"Its not just a problem in the South and Midwest.

On a recent Saturday night, my kids and I were driving through Boston's North End (our Little Italy), and the restaurants were teeming with people.  Mike's Pastry, which is famous for its cannoli, was truly packed - probably 50 people waiting in line.

It  was a shocking and depressing sight, especially in ""Maskachusetts"".",pro-mitigation,unclear,unclear,pro-mitigation
"I think positive incentives from employers is a smart way to start making all employees aware of a company's position on vaccinations. After some period of time, when it has become clear that the remainig unvaccinated employees will not be incentivized with a carrot, then negative incentives should be tried. Adding vaccination status to an employee's performance evaluation along with appropriate pay raises would either incentivize vaccinations or drive those folks to find employment elsewhere, which should make those that did receive their shot feel safer when coming to work.",pro-mitigation,pro-mitigation,pro-mitigation,pro-mitigation
"This is one of the most depressing aspects of our uniquely American reaction to the messaging by public science and health experts. So, so many selfish people just couldn't be bothered to have good judgement and just thought the virus is anyone else's problem but their own. SO now, we have to deal with shutdowns and mounting economic disaster longer and longer because we're just too dumb to understand the concept of short term sacrifice for long term gain.",pro-mitigation,unclear,pro-mitigation,pro-mitigation
Neither.  It is protecting workers who have chosen to be vaccinated to be exposed to those who do not want to and even  even between those who do not want to vaccinate.,unclear,anti-mitigation,pro-mitigation,unclear
"To what extent is the legal risk mitigated by insurance?

What exposure does a company have, if a vaccinated person is exposed to an unvaccinated co-employee and gets sick? 

What if a vaccinated or unvaccinated customer is exposed to an unvaccinated employee and get sick?

In America, anyone can file a lawsuit.  The “what-ifs” on Covid policy can drive us crazy and can lead to paralysis.  I think the risk-benefit analysis should be weighted in favor of herd immunity and, therefore, a mandate with reasonable accommodations as noted in the article.",unclear,unclear,unclear,unclear
Notwithstanding Senator Paul's  explanations data now available from India shows that the delta variant infected more younger people and the death rates were higher in younger people. In fact the death rates were higher in people who were younger than 55 than older people. The good news was that vaccines were still effective. So we can vaccinate and wear masks if not vaccinated.,pro-mitigation,pro-mitigation,pro-mitigation,pro-mitigation
"Everyone should spend a few minutes on Youtube after entering ""anti masker"" in the search engine, step back and watch the clown show.  The most common excuses are ""medical exemption!"" usually screamed at the top of their powerful lungs, ""violating my constitutional rights!"", usually accompanied by a MAGA cap, and ""The virus isn't real, and I am not a sheep!""...  All you have to do after that adventure is use the NYT's county by county vaccination percentage map to know where NOT to move or send your children to school.",pro-mitigation,unclear,anti-mitigation,pro-mitigation
"Wearing a mask is so trivial.  Staying home, closing businesses, never seeing anyone - those are serious, and need to be seriously considered before re-imposing those rules.  But masks?  A scrap of fabric on your face?  Get over it.

Of course, if everyone who can would just get vaccinated, we wouldn't need to, but that isn't the case yet.",pro-mitigation,anti-mitigation,anti-mitigation,pro-mitigation
"Less than 1 year of clinical trials. The average is 4-10 years of trials for vaccine approval. We are putting a whole lot of faith in the pharmaceutical industry, at this point. Which is a switch, as most on here would never have taken that position before the pandemic began.",anti-mitigation,unclear,anti-mitigation,unclear
"""Some scientists agreed, but urged a localized approach.""

It is obvious that the new Delta variant know no boundaries with whom or where to infect in the world. Why are some scientist in favor of a 'local approach' especially in those local areas who's rights and personal freedoms are in jeopardy of being taken away, rather than spreading a medical concern during a pandemic.

“We don’t want to return to lockdown or more disruptive mandates here,” Dr. Ferrer said. “We want to stay on the path we’re on right now, which is keeping community transmission really low.”

And will add, what about the global traveling markets of people -  air land and sea. 

Have my two Gate Chips and still where a mask in the markets because out of 330 mil Americans, only 34.5 million have been confirmed; leaves about 298 million who have never caught the disease...and how many of these have not been inoculated today?  There is also no guarantee my two Gate Chips will last longer than 6 months.

Waiting patiently for the fall flu/virus program to start here after all the summer tourism come back home to start school again. Already business/schools governments are talking Mandatory Vaccination ....why buy local policy...and not federal policy? Delta cares not who implements the program; we only care that it is implemented all across the country and to those coming and leaving.",pro-mitigation,unclear,pro-mitigation,unclear
Science doesn't care about your feelings.,unclear,unclear,unclear,unclear
"To enter elementary school they ask for your vaccines, every year. When you immigrate to the US and request your green card, they ask you vaccines for a half a dozen eradicated viruses, but you can’t ask for a Covid vaccine certificate? It is not about privacy, it is common sense.",pro-mitigation,pro-mitigation,pro-mitigation,pro-mitigation
"I respect anyone's right to make a bad health decision. But, when that bad decision has implications to everyone else's health, we are beyond respecting 'personal choice.' 

There is no rational reason to defer getting an evidenced-based vaccine administered to millions of people already. 

There is no real religious basis to getting it either: most all leaders of major religions have endorsed the vaccine. (What could be more pro-life than a vaccine that prevents COVID related death?)

If you are on the fence, please get vaccinated.",pro-mitigation,pro-mitigation,pro-mitigation,pro-mitigation
This should not be an issue in a country where workplace drug tests are commonplace.,pro-mitigation,unclear,unclear,pro-mitigation
And would you like fries with that virus?,unclear,unclear,unclear,unclear
"It is truly stunning how much people are willing to risk for a meal or some transient entertainment.  I have not eaten in a restaurant since February, and while I do miss the occasional convenience and sense of being out in public, I cannot justify the risk to myself, my family, and my community.  

What are these people thinking?",pro-mitigation,unclear,pro-mitigation,pro-mitigation
"Every owner or manager or employee of a bar, restaurant, or gym needs to stop talking about ""freedom and liberty"" and start insisting that their patrons get smart and socially distance and wear masks.   

Owners, so desperate to get some income (as if they were the only ones hurting) ignored the warning and allowed people to be stupid ... yes it was their right to be stupid but if you want your business (and others' who did in fact insist upon safe behavior and not simply give the ""rules"" lip service) to survive, you'd better do what science says you must do:  wear masks, socially distance.  

Now everyone's paying the price for your inability to ""wait for the marshmallow"".",pro-mitigation,pro-mitigation,pro-mitigation,pro-mitigation
"Stimulus payments should go to the businesses and employees of them most affected by this pandemic - yes restaurants, bars and households where a parent must stay home from work to facilitate remote learning. This instead of blanket payments to everyone who is still gainfully employed and doesn’t need it. This could be achieved by a securely encrypted IRS opt-out app. But hey, everything’s going to be back to normal soon so why waste $$ on such a thing?
Next, restaurants and bars could be assisted to implement a delivery model using their own employees since fewer are needed for outdoor and curbside/carry out. Allow forgiveable loans so that electric vehicles outfitted with hot boxes and chill boxes can be obtained by the business for home delivery servers to use rather than their own vehicles. Include delivery of alcoholic beverages with ID - because not allowing that is plain silly. Revamp menu items to include delivery options that can be easily warm and serve in the home.
I’d gladly pay 20% gratuity for tasty meals and drinks brought to my door by the restaurant and not a 3rd party delivery aggregation service. 
Everyone thinks things are going to return to normal soon so too many think it is a waste of time to reinvent in this way. Right.",pro-mitigation,unclear,unclear,unclear
"I haven’t stopped wearing a mask indoors at places (grocery store, takeout at restaurants, pharmacy etc.) where people come in and out. Granted I don’t work at these types of establishments but the CDC advice seemed foolhardy. I’m pregnant, healthy, but given my pregnancy at higher risk of a break through infection, hospitalization and other more serious consequences should I contract Covid-19. We have a small, unvaccinated (due to ineligibility) child that I’d like to protect Wth available simple common-sense measures.

Wearing a mask indoors for sparing amounts of time (for the majority) is a minor inconvenience. While I too, am annoyed by those who are choosing not to be vaccinated— my actions are based on those who are medically vulnerable and/or ineligible.",pro-mitigation,anti-mitigation,pro-mitigation,pro-mitigation
"We got tired of our own cooking to.

So we ordered take out from our neighborhood restaurants that either had tables to pick up food in big parking lots, or had curb side pickup.

I would like to sit in a nice buzzy venue with friends and family for a couple of hours too.

I would like to feel safe in the grocery store.

I would like to see my grandchildren.

But I won't be, for what looks like a long time.  I am willing to sacrifice these things so that people will not die or be left with life long cardiac, brain and lung damage.

Does that make me a fool?",pro-mitigation,unclear,unclear,pro-mitigation
"Had dental work done this morning. I got into a discussion with a female dental tech, who told me she does not intend to get herself vaccinated. So that raises the question: Shouldn't all health-care workers get vaccinated? Seems silly to even ask the question, but it's common sense and the answer is yes. The patient, me, got his two shots of the Moderna vaccine in February.",pro-mitigation,pro-mitigation,pro-mitigation,pro-mitigation
If you are vaccinated there is zero difference being around someone who is vaccinated and has covid vs someone who is not and has covid.  There is still covid in the air but you are protected.  Quit worrying about others.,anti-mitigation,pro-mitigation,anti-mitigation,pro-mitigation
I'm fully vaccinated. I've done my part. I'm NOT going back.,pro-mitigation,pro-mitigation,pro-mitigation,pro-mitigation
"Clearly some spread is going to happen as people are more public, but there still isn't a very convincing case being made that these businesses need to be shut down en masse by the government. It stands to reason that if you can effectively trace cases to restaurants, you can trace them to *specific* restaurants. Alert (and fine, if necessary) the places that are identified; closing the entire sector because of 1 or 2 locations is absurd.

The statistics you present in the article are also not being put into their proper context. Louisiana, for example: ""roughly a quarter of the state’s 2,360 cases since March that were outside of places like nursing homes and prisons have stemmed from bars and restaurants.""  Translation: 79 cases in a state of over 4.5 million people. The article also fails to note that they categorize an outbreak as *2 or more cases*. Even so, the attempts to paint the picture that ignorant restaurant/bar goers are slamming hospitals has so far been successful, if not factual.

Obviously this is a virus that should be taken seriously and efforts should be made to mitigate its spread. But we need to move past long-term and seemingly arbitrary closures of entire sectors of the economy. We are well past the point of ""just close x businesses for x amount of time"" as a public strategy.",anti-mitigation,unclear,pro-mitigation,unclear
"I thought that when the CDC lifted the mask restriction that it was making a huge mistake. We should have left it in place until our vaccination rates were higher. There will be no going back for the people who were already anti-mask (many of whom are also anti-vax). So now even with Delta circulating we will have to accept that some will do nothing to help the rest of us. 
I, for one, have gone back to wearing a mask in public places (even though vaccinated). 
Btw, the other day I was in an indoor venue with coughing sneezing teenagers.  Were they vaccinated? Were they sick? Were they tested? Were they sick with covid? What am I supposed to do - interrogate them? Ludicrous. I will just wear my mask, thanks.",pro-mitigation,pro-mitigation,pro-mitigation,pro-mitigation
"I’m a retired physician and vaccinated as
well and have come to the same conclusion.",unclear,pro-mitigation,unclear,pro-mitigation
"This issue should not be addressed by for-profit businesses on a firm-by-firm basis.

The FAA should require vaccination to fly on an airplane. The federal government should require all federal employees and federal contract workers be vaccinated. All schools and colleges should have to require students, faculty, staff, and contract workers to be vaccinated as a condition of receiving federal funding. All hospitals and medical centers must have all employees and contract workers vaccinated to be reimbursed by Medicare. Use federal government funding to create really strong incentives for the population to become vaccinated.",pro-mitigation,pro-mitigation,pro-mitigation,pro-mitigation
Any Company or Employer that does not make this Mandatory is completely irresponsible!,unclear,unclear,pro-mitigation,pro-mitigation
"Since many people have been working remotely, how about requiring it if you intend to return to the workplace; if you don't want the vaccine, keep working remotely. I also think insurers should have higher premiums for the unvaccinated.",pro-mitigation,anti-mitigation,unclear,unclear
"Without knowing for sure that all employees (and others allowed to enter a company’s worksites) have been vaccinated or otherwise have Covid immunity, all will have to wear masks.  Or they should have to wear masks.  Thus, those who refuse to provide proof of vaccination or adequate antibody levels are subjecting all others to mask wearing.",pro-mitigation,pro-mitigation,pro-mitigation,pro-mitigation
"On one hand, personal and community responsibility entails vaccination.   So by this logic, those who refuse the vaccine might then lose the right to public E.R. or private insurance coverage due to Covid-19.

On the other hand, would that punishment really be moral and fair?  

Consider that many of the skeptics may also be considered victims of weaponized communication. 

Have all Americans done our part to ensure regulation/defense of the platforms?  

<a href=""https://www.ncbi.nlm.nih.gov/pmc/articles/PMC6137759"" target=""_blank"">https://www.ncbi.nlm.nih.gov/pmc/articles/PMC6137759</a>/

<a href=""https://gh.bmj.com/content/5/10/e004206"" target=""_blank"">https://gh.bmj.com/content/5/10/e004206</a>",unclear,unclear,pro-mitigation,unclear
"If you're over 70, obese, diabetic, or any combination thereof, it's probably wise to stay home or wear a hazmat suit when you go out.
Leave everyone else alone.  

If the hospitals begin to get overwhelmed, we can scale back then.  

Your safety is your responsibility.  You are the only one who can put on your gloves, goggles, and mask.  So do it.  

This idea that your mask protects me but doesn't protect you is just ridiculous, unscientific, ludicrous, and ignorant.  Masks don't have some magical one-way weave.  

Of course, the demographic that believes this nonsense (but doesn't wear eye protection) is the same demographic that gets taken by every phone scam and internet scam known to mankind.",anti-mitigation,pro-mitigation,anti-mitigation,pro-mitigation
"The health insurance policies might  step in.  Will they cover people who don't get the vaccine  and then get COVID?
Also, does OSHA have updated rules for what is safest?",unclear,unclear,pro-mitigation,unclear
i wouldnt eat indoors anywhere in the world if it were free.,unclear,unclear,unclear,unclear
"It’s very likely that in the near future a yearly booster will be required to address new variants and maintain protection - and I’m perfectly okay with that. Today is my “get out of covid jail” day - 14 days post-vaccination - and I’m feeling incredible gratitude to all the scientists, trial volunteers, and first responders whose extraordinary efforts got us here. I’m also feeling real sadness for those we lost, including my mom. Let’s do everything we can to avoid repeating the nightmare of 2020. Mask up, get the vaccine and let’s move on.",pro-mitigation,pro-mitigation,pro-mitigation,pro-mitigation
Any company that picks up portion of health care cost should (in my opinion) have a 50/50 co-insurance with a 8k deductible for Covid health care costs if a person declines the Covid vaccination.,pro-mitigation,pro-mitigation,pro-mitigation,pro-mitigation
"No mention in the article about the constraints of physically distancing in a hot kitchen (while masked) in the middle of summer.  What about the people preparing the food, in addition to the front of the house?",unclear,unclear,unclear,unclear
Why is the Times quoting a non lawyer-public health expert (Karl Mingus) on potential legal liability?  I don’t think he’s correct on the law across all 50 states and he should not be offering legal advice in any event.,unclear,unclear,unclear,unclear
"All of you stating that dropping the mask mandates and “freeing” the vaccinated was a bad idea….how about just come out and tell the truth for once?  That you are in favor of *permanent* lifestyle change and masking in society.  Quit acting like “just a little longer” will satisfy you; you know and we all know that it won’t.  For reasons best understood by you, you are getting some kind of benefit from the pandemic in general and masks in particular, and seeing other people return to normal upsets you.  I’m genuinely, truly sorry you feel that way.  But if vaccines are not the end, then there is NOT an end.  I got vaccinated…and I am moving on.  You are welcome to mask(s) up (and face shield(s), and goggles, and gloves, and gowns) for the remainder of your life if you so choose; no one will stop you.  But enough already of bullying other people into catering to your fear and your anti-science, anti-vaxx religion of facial fabric.  I hope at some point you actually get excited and happy to see things getting better; normal life is great, and will be waiting for you if ever you decide to rejoin.",anti-mitigation,unclear,pro-mitigation,anti-mitigation
