text,annotation_34,annotation_5,annotation_20,annotation_4
"I am a liberal democrat. I wore my mask, I stayed home, I only got together with friends if it was outside and we stayed distant. I kept doing that even after I was fully vaccinated even though I thought it was silly because I know the science. Not only am I safe, I can’t give it to others either. Seriously, what am I doing by wearing a mask other than wasting money and giving myself skin rashes and acne? Literally nothing. Period. But still, just in case I kept masking. I know evidence can change the details - especially when we have more of it. But then we got more evidence - a bigger pool of people who were vaccinated - and the CDC concluded masks were no longer useful and that was enough for me. I’m not going to start masking up again, not even at work where they’re trying to require it. I am not going to stop getting together with my friends indoors. I am not going to stop going out to eat and drink. I’m so completely over it.",anti-mitigation,anti-mitigation,anti-mitigation,anti-mitigation
And what does this suggest for reopening schools?,unclear,unclear,unclear,unclear
"I find this anti-vaccination movement fascinating.

I just illustrates the decline of IQ in the US",pro-mitigation,pro-mitigation,unclear,pro-mitigation
"If I had the choice, I would fly on the airlines ( or do business with a company ) who had their employees vaccinated rather than risk the virus with a company who didn't care about my wellbeing.",pro-mitigation,pro-mitigation,pro-mitigation,pro-mitigation
"It wouldn’t matter if it was only anti-vaxers at risk.  Their deaths would be further proof of natural selection and survival of the fittest.  But they affect normal people also. 

Maybe put them in specially isolated ventilation covid areas.  Could put smokers in there also.",pro-mitigation,unclear,anti-mitigation,unclear
"It's simple.   Raise health insurance premiums for the unvaccinated!  Or better yet, deny them coverage at all.",pro-mitigation,pro-mitigation,pro-mitigation,pro-mitigation
"There seems to be several identifiable cohorts resistant to taking the vaccination (albeit for now). These include: A. Anti-vaxxers in general who reject it all. B. Certain Blacks who discredit the medicine/ government /public health establishment. C. Too many adults under 30 who are too apathetic and claim Covid is not a threat to them ( which ignores the transmissibility aspect ). D. Certain types, mostly Trumpers, who wish Biden ill politically yet are cognizant that Operation Warp Speed was the former president’s business and, in fact, Trump took the inoculation promptly. The sum of these four groups is reaching towards a quarter or third of general adult population. This phenomenon limits the speed and breadth of reaching herd immunity. Public health messages, personal doctor consultations, passage of time without bad vaccine outcomes and employers’ pressure will chip away the remainder over next six-twelve months.",pro-mitigation,pro-mitigation,unclear,unclear
"Will companies that require the shot also provide paid days off for the side effects? A ""two hour"" bonus isn't really the same.",unclear,unclear,pro-mitigation,anti-mitigation
"Reading the comments, I am sad that in America, the country of freedom, so many people are eager to implement measures that most dictatorship would not have dared to do. I want to quote one of your founding fathers, Benjamin Franklin:
""Those who would give up essential Liberty, to purchase a little temporary Safety, deserve neither Liberty nor Safety."" If you look at the data carefully, you will realize that most people will die from other causes than this virus.",anti-mitigation,unclear,unclear,anti-mitigation
I don’t want to go back to work with unvaccinated people. Why should I be put at risk?,pro-mitigation,pro-mitigation,pro-mitigation,pro-mitigation
"The majority have zero effects from an infection. I had the worst I ever saw, 78 days. The long haul covid sufferer of the NYTimes is even better now. We have some idea of the long term effects of an infection. Although it's bad, living with angry self righteous people in fear is worse, considering the risks are so low now in most counties.",anti-mitigation,unclear,anti-mitigation,unclear
There are 10 million people in LA county and there were 250 new cases of COVID on average per day in the last week.    You better mask up!,pro-mitigation,pro-mitigation,pro-mitigation,pro-mitigation
Infection control is way down the list of priorities of party animals. somewhere between Call Your Mother and Eat More Vegetables,unclear,unclear,unclear,unclear
"I work in Westchester, NY in an office setting.  I was ordered back to work two months ago even though I felt unsafe-it was either that or no job. We are not wearing masks, not social distancing-indeed taking zero precautions. Although I personally wish that we were able to work from home for the safety of everyone, we are not being given that option. What is one person supposed to do?",pro-mitigation,unclear,pro-mitigation,pro-mitigation
"The willingness of so many Americans to accept so much unnecessary death and economic dislocation as a result of one rampant virus is pretty pathetic. Since when were we a nation of quitters?

Covid-19 may have just been Nature's warning shot: the next virus could be much, much worse. We need to grow up, sidestep the Trumpian politicization of the pandemic, take science seriously and deal with this public health crisis for once and for all.  

As part of this national effort, proof of vaccination should be required in order to keep your health insurance, to attend public schools, or to be employed by any federal or state agency.  Period. 

If the anti-vaxxers and Fox News fans want to huddle together, unvaccinated, and see what happens, that's their right as long as they don't endanger others through their negligent actions. 

How about we give them Wyoming or Texas to run as vax-free zones and see how long they last.",pro-mitigation,anti-mitigation,pro-mitigation,pro-mitigation
"If YOU are vaccinated, why would you demand an employer mandate vaccines for everybody else? If you are protected against a disease, other employees' health treatments are none of your business. Make no mistake, the comments here aren't about concern about fellow citizens, it's about ""punishing"" other Americans with opposing political views. How about instead we have all Covid vaccinated people wear a red V on their foreheads and then you will know who it's ""safe"" to hang around with?",anti-mitigation,unclear,anti-mitigation,anti-mitigation
"Although I believe in individual freedom, I also believe in personal responsibility and accountability. There was a quote "" One's freedom end when another person's begin.""  When vaccines are readily available, vaccinated employees should be able to  sue their employers if the OSHA COVID guidance/ requirements are not followed. Also, at a certain date in the future, medical insurance companies and Medicaid must  refuse payment to patients admitted for COVID if they can't show proof of vaccination.  Also commercial establishments (restaurants, malls, groceries)  and public transportation companies (airlines, trains and busses, taxis) need to require proof of vaccination for service or risk getting sued if an infection occurred. Their premises must be labeled accordingly.  These actions mostly from private sector  would satisfy an individual's freedom of choice with personal responsibility and accountability. Like in the old days with leprosy, they could stay together in their own enclave.",pro-mitigation,pro-mitigation,pro-mitigation,pro-mitigation
"My sister is immun-suppressed , has not been able to receive a vaccine due to unbelievable red tape, and is at the mercy of the employees of the institution where she lives who are not vaccinated.  I cannot for the life of me understand why states are allowing nursing homes to retain employees who are  not vaccinated.

And, business owners who may be reading this - I your customer am not coming to your businesses unless I know that your employees are vaccinated.  I may be vaccinated, but what if I carry your employee's virus to my sister?",pro-mitigation,pro-mitigation,pro-mitigation,pro-mitigation
"Who the heck would work somewhere where the employer has to ""balance"" the need for ""privacy"" versus the health and safety of its employees?  That it took so long for employers to transition to remote work in the beginning of the pandemic is reason enough not to put faith in corporatocracy.  In a public health emergency, capitalism can take a backseat.",pro-mitigation,unclear,unclear,pro-mitigation
"The Trump administration doesn't really care about the owners of restaurants and bars, and whether their customers get the virus.  They just wanted everyone to get in their cars and pick-up trucks and drive again.  They are working for the oil companies.",unclear,unclear,pro-mitigation,unclear
It is within the duties of a company to protect the workers. Unvaccinated employees provide the material for an unsafe contagion to spread.,pro-mitigation,unclear,pro-mitigation,pro-mitigation
"Tucker Carlson refers to face masks as “obedience masks”.
I presume this has contributed to unvaccinated people refusing to wear face masks.",unclear,pro-mitigation,pro-mitigation,unclear
"When crossing the border into countries, be it by land, sea or air, several still request to carry your Carte Jaune, aka Yellow Card, showing your vaccinations or prophylaxis.

Immigrants to the US have to show their vaccine booklet before being able to arrive on these shores with an immigrant visa.

In both situations it is obviously not considered to be a privacy issue.

Yet when it comes to the worst pandemic around the planet, a large percentage of people -  especially in this supposedly most advanced nation in the world -  are paranoid, accusing the government taking away their freedom.

The crux in the US is that Social Security numbers are used as an  ID all over the place that have nothing to do with it, and making us all vulnerable to identity theft.","pro-mitigation,pro-mitigation",,unclear,pro-mitigation
"Wrong. New cases seem to be increasing exponentially in the UK right now and are at ~20,000 per day.

Don’t listen to Dave; he doesn’t know anything.
Be alarmed.
Wear a mask and get vaccinated!",pro-mitigation,pro-mitigation,pro-mitigation,pro-mitigation
"Perhaps we need more PSA on TV (ahem, FOX News), print posters on storefront windows, etc. —particularly in conservative markets. The more the “it’s your patriotic duty as an American citizen” message is drilled into their heads, the more assuaged they will be.",unclear,unclear,unclear,pro-mitigation
"35 percent of NYPD are vaccinated. 
You think the union is going to agree to make it mandatory!?",unclear,pro-mitigation,unclear,unclear
"I survived covid and got my shots. Besides avoiding covid, I never had a sniffle or a cold, no flu in the last year plus. I'm used to keeping a box of masks in the car and wearing one in a store is second nature. My hand washing routine is also second naturem Japanese people have been wearing masks in public places for years, why not me. It's nobody's business if I want to keep wearing a mask.",pro-mitigation,pro-mitigation,anti-mitigation,unclear
"My company so far has not mentioned vaccinations at all in terms of return to office plans. But being in NYC, its kind of assumed that everyone will get the shot, or work remotely. I could see a conditional requirement being entirely reasonable; if you're in a large room with N number of other people, you need the shot. Otherwise you work remotely. This would not help service industry workers who game the system with ""religious exemptions"" but are actually just antivax though...",pro-mitigation,unclear,pro-mitigation,pro-mitigation
"America already requires some vaccines for school, why not the COVID vaccine for workers?  We have requirements for all kinds of things, why not this one?  Somehow COVID has become so politicized, thanks to you-know-who, that previously-responsibly people are now acting like anarchists.  (Not to give anarchy a bad name.)  That's the same you-know-who who got tested every day and had everyone around him tested every day, got state of the art medical care at taxpayer expense when he tested positive, and was vaccinated as soon as the vaccine became available.",pro-mitigation,pro-mitigation,pro-mitigation,pro-mitigation
"Cases are not hospitalizations, which aren’t rising

Nor are deaths

It’s been clear from the UK then SA now Delta variant that the experts were itching to reimpose restrictions",anti-mitigation,pro-mitigation,unclear,pro-mitigation
"We're in what's called a pandemic, folks. Please have your beloved ""deep bowls of farro"" at home. If you want to feel like you're in a restaurant, just blast some annoying music and set up a table near the bathroom.",pro-mitigation,unclear,pro-mitigation,pro-mitigation
"I work at an FQHC and you would think we would mandate vaccines wouldn't you?  And you would think that hospitals would too, but they haven't.  We haven't because we thought giving it time would increase participation.  That has worked but not 100%.  And now we don't because of fear of litigation, because even though the EEOC has said employers can mandate the vaccine,  that does not prevent somebody from suing us. That is probably the reason many entities that should know better, are not mandating.   If the Federal government wants to remove the fear they could either create an insurance fund, or some other method to protect employers.  The manufacturers are already protected.  The producers of COVID tests are already protected.  If employers were protected I believe we would see many more mandates.  And as others have noted, vaccination is a public health measure not an individual health measure.  By the way here is another suggestion:  our legal counsel says that we CAN put up signs in our clinics that say ""you have the right to be served by  fully vaccinated staff members. Please ask us if you have any concerns. ""  Many of our patients are also ""hesitant"" so this tactic may not work but I think it is worth a try if you work at any entity where the people coming through the door have a reasonable expectation that the entity has taken all possible steps to assure their safety.  Like in health care.",pro-mitigation,pro-mitigation,anti-mitigation,anti-mitigation
"In California, indoor dining is prohibited in most counties, while socially distanced, masked outdoor dining is permitted. Restaurants have taken over a great many parking spaces in this ostensibly “car crazy” state.  I

I would not be so moralistic about people going to restaurants. Many restaurants are small businesses, often owned by immigrants, which are the backbone of urban neighborhood commercial districts. Supporting these businesses is a positive thing. Restaurants are among the few destinations outside the home in a time when cinemas, concert halls, libraries, museums, and other public spaces are all closed. With the pandemic likely to continue for many months, is it reasonable to expect that people will stay cooped up in their homes indefinitely? That is the kind of lockdown that is likely to produce explosive, unhealthy reactions.

To me, the discourse about unsafe activities is less than logical. Most states (though not California)give churches largely get a free, unregulated pass, even though they have repeatedly been the site of mass spreading events. Restaurants are scrutinized. Many parents demand on site school openings, though these have regularly been followed by outbreaks. Transit is demonized, though it has not been the site of  contagion anywhere in the world(perhaps because transit in the US is associated with the poor).",unclear,unclear,pro-mitigation,pro-mitigation
"No doubt, companies should require it. Not compulsory, you can go elsewhere. It is a simple safety measure, why compromise the health of employees. If you are not vaccinated, don't come!",pro-mitigation,pro-mitigation,pro-mitigation,pro-mitigation
"I enjoyed your article and it outlined the problems well. One correction though. The Supreme Court case to which you referred (Jacobson v. Massachusetts, 1905) had nothing to do with public schools per se. It concerned a law requiring adults to be vaccinated against smallpox or be subject to a fine.  However, the ruling had much broader implications for the power of the state to impose compulsory vaccination mandates when the safety of public health warranted them. 
Philip M. Rosoff, MD, MA
Professor (Emeritus) of Pediatrics and Medicine 
Duke University School of Medicine",unclear,pro-mitigation,pro-mitigation,unclear
"I've been vaccinated for some time now and I live in a part of the country where vaccine compliance is high and Covid-19 infection rates are low and dropping. That said I have not and do not intend to stop wearing my masks (doubled disposable surgical masks) in any situation where infection is possible for as long as I need to share the nation with people who shirk their civic duty and willfully refuse to be vaccinated and to mask themselves. 

When someone asks me why I simply say that I am ""Chicken"".  That comment disarms them in most cases. 

In the rare occasion when I encounter a genuine red state pandemic denier (a rare and endangered species in deep blue Western Massachusetts) I simply let them have their say (from a safe distance) secure in the knowledge that ""you can't fix stupid"" and that they are likely self selecting to be infected by SARS-CoV-2 Delta varient and if it proves fatal taken out of the gene pool and off the registered voters lists.   This is simply natural selection at work (something else most of these folks don't believe in).",pro-mitigation,unclear,anti-mitigation,pro-mitigation
"Let's stop all the whining and moralizing.  If a person is at-risk, they should remain isolated and at home.  If a person feels uncomfortable not wearing a mask - then wear a mask.  However, for those of us who are healthy and vaccinated - let us choose where and when, if at all to wear a mask.  If you are vulnerable, it is your personal responsibility to protect yourself from the risk I may pose to you - not the other way around.",anti-mitigation,pro-mitigation,pro-mitigation,anti-mitigation
"My simple answer to this is: No, I'm not going to wear a mask again!

Our family is vaccinated.  That's all we can do and it's all we're going to do.  This is going to sound harsh, but I'm going to say it anyway.  There is plenty of vaccine available, and if you've chosen not to get vaccinated, I don't care if I pass the virus to you!  I really don't.",unclear,anti-mitigation,anti-mitigation,unclear
"We’ve become a country of self-serving individualists whose minds have been softened by social media and misinformation, rather than a nation pulling together during a crisis. We have a vaccine for an illness that has killed almost 600,000 of us, and people still don’t get it? We are lucky and rich enough to have enough vaccine for everyone in the US, while other people on our planet are struggling to obtain doses. Those of us who can get the vaccine can protect those who cannot for medical reasons by herd immunity. Where is our concern for our fellow citizens and human beings?",pro-mitigation,unclear,pro-mitigation,pro-mitigation
"We wouldn’t be facing questions about masking if everyone who is eligible to be vaccinated got vaccinated.  Then we would truly be back to normal, or very nearly so.  As it stands, we are at the mercy of the anti-vaxxers, as we are the anti-maskers.

A question:  How much possible harm can someone wearing a mask cause?  Answer: none.  And how much possible harm can someone not wearing a mask cause?  Answer: sickness and death for themselves and others, and perpetuation of the pandemic.  So it’s those who aren’t wearing a mask who should have to justify themselves, not those who are wearing them.",pro-mitigation,pro-mitigation,pro-mitigation,pro-mitigation
"Wow. Some differing opinions here! I enjoy going out to eat and traveling-the latter has been a significant hurt since I am out of the country 2-4 times a year. I support local businesses and those smaller producers with whom I have long standing relationships. However, salaries have been cut and jobs lost, I can't see a full recovery for at least a year-it all depends on viral recurrence this winter and vaccine progress. Scientific pundits are correct in that Covid is now endemic and will periodically pop up in local bursts even after a vaccine depending on local levels of acquired immunity.",unclear,unclear,anti-mitigation,pro-mitigation
"The CDC,  motivated by the ulterior motive to induce Americans to get vaccinated, has put ""masks off"" as a carrot on the plate of Americans hungry to resume normal lives.  

Most members of the medical profession, including immunologists,  know little about the intrinsic character of SARS-CoV-2, which I bet the DOD believes, with cause, is an engineered bio weapon.  There are a few bio-scientists who  do understand this is a 21st Century bio weapon designed to evade defeat, and expect future variants to emerge that will be more easily spread and more lethal than the Delta variant.  

These scientists get the solution will not be provided by 20th C. tweaked antibody immunology platforms, but by 21st C. targeted killer T-cell platforms that will not merely block spike proteins, but will penetrate the cover of the spike protein to reside in a static target inside to continue to engage killer T-cells that will continue to defeat SARS-CoV-2 in its constant state of mutation.

So how can journalists or the public not be confused, as well as suffer from vaccine-Covid angst, in a state of ""masks off"" denial and avoidance.  As a life long sailor on the great lakes, I am familiar a lull before a violent storm hits.

It is important to think critically about what the result of ""masks off"" can objectively be anticipated to be in 3 to 4 months, when retrospectively it will be possible to conclude this was a national spreading event.   Localized - really?",unclear,anti-mitigation,pro-mitigation,unclear
"I am libertarian on most issues but not this one. In a 40+ year career in health care we had all sorts of mandatory testing, mandatory hepatitis B vaccines, free flu shots, special rules for employees with highly contagious conditions, and special rules for pregnant employees. Some policies were required by licensure rules; all were to protect both the patients and the staff themselves. Covid vaccine is no different. It should be mandatory for returning to the office, and should be backed up by suspension and termination for cause, preventing severance pay and unemployment for those who refuse without a bona fide medical waiver. A few well placed firings will be needed in order to get the point across but we cannot keep the economy hostage to both the disease and failure to get vaccinated.",pro-mitigation,pro-mitigation,pro-mitigation,pro-mitigation
"While I'm sure some customers wanted to eat out again, ""the nation"" hasn't been clamoring for this. Most potential customers are voted with their feet to save their lives,and are staying home. Some restaurant owners, particularly corporate ones,  wanted to reopen, even if it killed a few people, and government officials were only too happy to value commerce over human lives when given the chance. Keep those campaign contributions coming in from people, and corporations, with money! Forcing workers back into unsafe workplaces, and then lying to say it was their ""choice"", is shameful. So is claiming a business, or workplace, is safe if people kinda sorta wear masks sometimes and sometimes keep six feet away from each other, but not really and not all of the time.",pro-mitigation,anti-mitigation,pro-mitigation,unclear
Many companies have mandatory drug tests for new hires.  Others have periodic drug testing and background checks.  Why not require vaccination for Covid as well?   Why is this such a big deal?,pro-mitigation,pro-mitigation,pro-mitigation,pro-mitigation
"The Nashville picture says it all. Unmasked people standing close together under a sign about ""mandatory"" masks. How many dead Americans will it take for people to ""endure"" a minor inconvenience?",pro-mitigation,unclear,anti-mitigation,pro-mitigation
"The headline is a stark reminder that there are a lot of people in our country who are so self-centered that they don't care what havoc they wreak by having their own way--gathering in public places like restaurants and theatres without wearing masks, for example.

""Psychology today"" reported in an article by Bill Eddy, lawyer, therapist, mediator and author, the following:  ""After 30 years as a conflict resolution professional in many settings, I believe that narcissists and sociopaths are an increasing public health problem. The feedback I get from professionals worldwide is that these two personalities seem to be on the rise and the cause of many marital, workplace and criminal problems.""

The Narcissist-in-Chief sets a terrible example to all Americans by his vain and selfish refusal to wear a mask.  It's little wonder that so many have decided to follow his irresponsible actions--do whatever you please, no matter who or what is harmed by your behavior.",pro-mitigation,unclear,pro-mitigation,pro-mitigation
